{
    "$schema": "http://json-schema.org/draft-07/schema#",
    "$id": "https://www.cjf.jus.br/cej/schemas/episodio-podcast/1.0",
    "title": "Episódio do Notas Técnicas em Podcast",
    "description": "Catálogo de episódios do podcast do CIn. Sem custódia própria de áudio (fora de escopo por ora, ver CIN_PLANEJAMENTO.md) — cada episódio aponta para o Spotify e o YouTube, onde está de fato hospedado. data/spotify/youtube são opcionais: nem todo episódio catalogado já teve esses dados confirmados (ver CIN_PLANEJAMENTO.md sobre achados parciais).",
    "version": "1.0",
    "type": "object",
    "required": ["id", "titulo", "notaRelacionada", "resumo"],
    "additionalProperties": false,
    "properties": {
        "id": {
            "type": "string",
            "pattern": "^[a-z0-9][a-z0-9-]*$",
            "description": "Identificador estável, normalmente espelhando o id da Nota Técnica relacionada."
        },
        "titulo": {
            "type": "string",
            "minLength": 1
        },
        "data": {
            "type": ["string", "null"],
            "pattern": "^\\d{4}-\\d{2}-\\d{2}$",
            "description": "Data de publicação da notícia/episódio, formato ISO. null quando ainda não confirmada."
        },
        "notaRelacionada": {
            "type": ["string", "null"],
            "pattern": "^nt-\\d{4}-\\d+$",
            "description": "Id da Nota Técnica em data/notas-tecnicas.json, quando o episódio corresponder a uma NT já catalogada."
        },
        "resumo": {
            "type": "string",
            "minLength": 1
        },
        "spotify": {
            "type": ["string", "null"],
            "pattern": "^https://open\\.spotify\\.com/",
            "description": "null quando o link do episódio ainda não foi levantado."
        },
        "youtube": {
            "type": ["string", "null"],
            "pattern": "^https://(www\\.)?(youtube\\.com|youtu\\.be)/",
            "description": "null quando o link do episódio ainda não foi levantado."
        }
    }
}
